Title,Summary,Content,URL,Contributor
Các mẫu đơn cho sinh viên,Danh sách mẫu đơn cho sinh viên và file mẫu,"""Xem chi tiết và tải mẫu đơn tại: http://qldt.hanu.vn/#/home/listbaiviet/bm/page/1/baivietct/2392930411139218765
CÁC MẪU ĐƠN CHO SINH VIÊN
1.	Đơn xin điều chỉnh đăng ký học phần
2.	Giấy chứng nhận sinh viên
3.	Giấy chứng nhận sinh viên (Tiếng Anh)
4.	Giấy xác nhận vay vốn tín dụng
5.	Đăng ký vé xe buýt
6.	Đơn xin cấp giấy giới thiệu
7.	Giấy giới thiệu thực tập
8.	Giấy giới thiệu đăng ký xe máy
9.	Mẫu cấp mới thẻ sinh viên
10.	Mẫu cấp mới thẻ sinh viên ( tiếng Anh)
11.	Giấy đề nghị cấp lại thẻ sinh viên
12.	Giấy chứng nhận hộ nghèo
13.	Đơn xin trợ cấp xã hội
14.	Đơn xin miễn , giảm học phí
15.	Đơn đăng ký học theo tiến độ nhanh
16.	Đơn đăng ký học theo tiến độ nhanh ( khối ngành ngôn ngữ)
17.	Đơn xin nhập học sau khi hết hạn bảo lưu
18.	Đơn xin nhập học sau khi hoàn thành chương trình trao đổi
19.	Đơn xin thôi học
20.	Đơn xin hỗ trợ chi phí học tập theo QĐ 66
21.	Đơn xin hỗ trợ chi phí học tập theo QĐ 136
22.	Mẫu khai làm thẻ CBVC 
23.	Đơn xin bảo lưu
24.	Đơn xin miễn học ngoại ngữ 2
25.	Đơn xin công nhận và chuyển đổi kết quả học tập
26.	Đơn xin không tính kết quả với học phần tự chọn
27.	Đơn xin miễn thi NLNN""",http://qldt.hanu.vn/#/home/listbaiviet/bm/page/1/baivietct/2392930411139218765,
Các mẫu đơn cho Lưu học sinh,Danh sách mẫu đơn cho Lưu học sinh và file mẫu,"""Xem chi tiết và tải mẫu đơn tại: http://qldt.hanu.vn/#/home/listbaiviet/bm/page/1/baivietct/5659289387213625415
Các mẫu đơn cho Lưu học sinh
1. International student Application form
2. Giấy chứng nhận sinh viên (tiếng Việt)
3. Giấy chứng nhận sinh viên (tiếng Anh)
4. Đơn đăng ký học tiến độ nhanh (dành cho LHS các ngành chuyên ngành)
5. Đơn đăng ký học tiến độ nhanh (dành cho LHS các ngành ngôn ngữ)
6. Đơn xin bảo lưu kết quả học tập
7. Đơn xin nhập học sau khi hết hạn bảo lưu
8. Đơn xin thôi học""",http://qldt.hanu.vn/#/home/listbaiviet/bm/page/1/baivietct/5659289387213625415,
"Hướng dẫn thực hiện quy trình, thủ tục hành chính qua hệ thống HANU Connections","""Nhằm hỗ trợ Sinh viên trong việc thực hiện các công tác đơn từ, thủ tục hành chính, Nhà trường chính thức chuyển đổi phương thức tiếp nhận từ giấy tờ bản cứng sang điện tử, số hoá 100% quy trình giải quyết thủ tục cho Sinh viên. Sinh viên sẽ tiết kiệm được thời gian, công sức đi lại và thuận tiện hơn trong việc theo dõi, cập nhật tình trạng đơn từ trực tuyến trên hệ thống.""","""1. Bước 1: Kích hoạt tài khoản
Bước 1.1. Truy cập đường link https://connections.hanu.vn trên trình duyệt máy tính hoặc tải ứng dụng HANU Connections trên hệ điều hành iOS/Android.
Bước 1.2. Lựa chọn “Sinh viên” để kích hoạt:
Bước 1.3. Nhập thông tin tài khoản, mật khẩu đã được cung cấp: 
Bước 1.4. Đổi mật khẩu theo yêu cầu
Lưu ý: Bấm chọn vào ô xác nhận.
2. Bước 2: Truy cập Phần mềm “Hành chính một cửa” để thực hiện thủ tục hành chính
Bước 2.1. Chọn mục “Hành chính một cửa” trên Dashboard. 
Bước 2.2. Điền đơn và nộp.
•	Sinh viên lựa chọn mẫu đơn đã hiển thị sẵn trên hệ thống
•	Các thông tin cá nhân (Tên, Ngày/tháng/năm sinh, Lớp, Mã Sinh viên,...) đã được tự động cập nhật theo thông tin của Sinh viên lưu trên hệ thống. Sinh viên chủ động điền các thông tin khác tại ô màu vàng để hoàn thành đơn.
•	Bấm “Trình ký” để nộp đơn
Bước 2.3. Quản lý đơn từ.
•	Sinh viên có thể theo dõi, quản trị tình trạng đơn của mình tại mục “Quản lý đơn của tôi”
•	Sinh viên sẽ được thông báo về thời gian nhận đơn sau khi cán bộ đã ký phê duyệt đơn
•	Sinh viên được chủ động in đơn sau khi được duyệt""",https://en.hanu.vn/a/70521/Huong-dan-thuc-hien-quy-trinh-thu-tuc-hanh-chinh-qua-he-thong-HANU-Connections/,
